{
  "schema_version": "1.0",
  "project_ref": "expflow:example-project",
  "at_revision": "epr_01J00000000000000000000001",
  "include": [
    "trees",
    "semantic_decisions",
    "workflows",
    "manifests"
  ],
  "workflow_occurrence_ref": null,
  "record_refs": [],
  "page_size": 100,
  "page_token": null
}
